{
  "schema_version": "1",
  "stream": "session/0b7e9c1d-2f3a-4b5c-8d6e-7f8091a2b3c4",
  "seq": 2,
  "type": "proposal.created",
  "payload": {
    "proposal_id": "6f1c2a3e-8b4d-4e5f-9a1b-2c3d4e5f6a7b"
  },
  "actor": {
    "kind": "agent",
    "id": "planner"
  },
  "ts": "2026-10-30T10:00:00Z",
  "trace_id": "4bf92f3577b34da6a3ce929d0e0e4736",
  "prev_hash": "0ecf0abfb97cb8272e4033a01c4cdb695fda27704a110f2f9ad61fd881fb740d",
  "hash": "0ec6ee5428a23382c8efcb0e9e64c4c97a7190d029ba9f8d47b943688de23c04"
}
